{
  "schemaVersion": "trajectory.v1",
  "subjectId": "subj.golden.hack-spam",
  "sessionId": "sess.golden.1",
  "turnId": "turn.hack-spam",
  "deviceId": "dev.golden.01",
  "capturedAt": "2026-07-16T12:00:00.000Z",
  "locality": "on-device",
  "consent": {
    "optedIn": true,
    "consentClass": "research",
    "recordedAt": "2026-07-16T12:00:00.000Z"
  },
  "toolCallIds": [
    "tool-0",
    "tool-1",
    "tool-2",
    "tool-3",
    "tool-4",
    "tool-5",
    "tool-6",
    "tool-7",
    "tool-8",
    "tool-9"
  ],
  "stages": [
    { "stage": "act", "status": "error" }
  ]
}
