{
  "schemaVersion": "trajectory.v1",
  "subjectId": "anika-k",
  "sessionId": "sess-bad-ckpt",
  "turnId": "turn-bad-ckpt",
  "capturedAt": "2026-07-15T21:00:00.000Z",
  "locality": "on-device",
  "consent": {
    "optedIn": true,
    "consentClass": "research",
    "recordedAt": "2026-07-15T21:00:00.000Z"
  },
  "stages": [
    {
      "stage": "act",
      "status": "ok"
    }
  ],
  "policyCheckpointHash": "latest"
}
