{
  "schemaVersion": "trajectory.v1",
  "subjectId": "subj.golden.invariant",
  "sessionId": "sess.golden.1",
  "turnId": "turn.invariant",
  "deviceId": "dev.golden.01",
  "capturedAt": "2026-07-16T12:00:00.000Z",
  "locality": "self-hosted",
  "consent": {
    "optedIn": false,
    "consentClass": "research",
    "recordedAt": "2026-07-16T12:00:00.000Z"
  },
  "stages": [
    { "stage": "act", "opCode": "tool.write", "status": "ok" }
  ]
}
