{
  "schemaVersion": "trajectory.v1",
  "subjectId": "subj.golden.format-breach",
  "sessionId": "sess.golden.1",
  "turnId": "turn.format-breach",
  "deviceId": "dev.golden.01",
  "capturedAt": "2026-07-16T12:00:00.000Z",
  "locality": "on-device",
  "consent": {
    "optedIn": true,
    "consentClass": "research",
    "recordedAt": "2026-07-16T12:00:00.000Z"
  },
  "stages": [
    { "stage": "format", "opCode": "protocol.format", "status": "error" }
  ]
}
